<?xml version="1.0" encoding="UTF-8"?>
<!ELEMENT participants (student*)>
<!ELEMENT student (name, regNo)>
<!ELEMENT name (#PCDATA)>
<!ELEMENT regNo (#PCDATA)>

